{
  "$schema": "https://json-schema.org/draft/2020-12/schema",
  "$id": "https://all-vc-info/schema/entity.schema.json",
  "title": "Investment Entity",
  "description": "One investment organization: a VC firm, accelerator, incubator, corporate VC, angel network/syndicate, government program, venture studio, micro-VC, or family office. Each entity carries its own provenance (sources[] with quotes) and a confidence rating.",
  "type": "object",
  "required": ["id", "name", "type", "region", "country", "sources", "confidence", "last_updated"],
  "properties": {
    "id": {
      "type": "string",
      "pattern": "^[a-z0-9-]+$",
      "description": "kebab-case, region-prefixed slug, e.g. tw-appworks, us-sequoia-capital"
    },
    "name": {
      "type": "object",
      "required": ["en"],
      "properties": {
        "en": { "type": "string", "description": "English / romanized name" },
        "local": { "type": "string", "description": "Name in local language/script if applicable" }
      }
    },
    "aka": { "type": "array", "items": { "type": "string" }, "description": "Alternate names, former names, abbreviations" },
    "type": {
      "type": "string",
      "description": "Primary organization type — must be a value from taxonomy.json#/types",
      "enum": [
        "vc", "accelerator", "incubator", "cvc", "angel-network", "angel-syndicate",
        "government-program", "venture-studio", "micro-vc", "family-office",
        "growth-equity", "crowdfunding"
      ]
    },
    "subtypes": { "type": "array", "items": { "type": "string" }, "description": "Secondary classifications, e.g. ['accelerator'] for a VC that also runs one" },
    "status": { "type": "string", "enum": ["active", "inactive", "acquired", "merged", "dormant", "unknown"] },
    "founded_year": { "type": ["integer", "null"] },
    "region": {
      "type": "string",
      "description": "Region bucket — must match a folder under data/ and taxonomy.json#/regions",
      "enum": ["taiwan", "united-states", "japan", "europe", "south-korea", "southeast-asia", "israel", "india", "canada"]
    },
    "country": { "type": "string", "description": "Specific country (esp. for europe/southeast-asia buckets), e.g. 'United Kingdom', 'Singapore'" },
    "hq_city": { "type": "string" },
    "offices": {
      "type": "array",
      "items": { "type": "object", "properties": { "country": { "type": "string" }, "city": { "type": "string" } } }
    },
    "website": { "type": "string" },
    "links": {
      "type": "object",
      "properties": {
        "linkedin": { "type": "string" },
        "twitter": { "type": "string" },
        "crunchbase": { "type": "string" },
        "other": { "type": "array", "items": { "type": "string" } }
      }
    },
    "capital": {
      "type": "object",
      "description": "Fund economics (mostly for VC/CVC/growth)",
      "properties": {
        "aum": { "$ref": "#/$defs/money" },
        "current_fund": { "$ref": "#/$defs/money" },
        "funds": {
          "type": "array",
          "items": {
            "type": "object",
            "properties": {
              "name": { "type": "string" },
              "vintage_year": { "type": ["integer", "null"] },
              "size": { "$ref": "#/$defs/money" }
            }
          }
        }
      }
    },
    "strategy": {
      "type": "object",
      "properties": {
        "stages": { "type": "array", "items": { "type": "string" }, "description": "from taxonomy.json#/stages" },
        "check_size": { "$ref": "#/$defs/moneyRange" },
        "ownership_target_pct": { "type": ["string", "number", "null"] },
        "lead_or_follow": { "type": "string", "description": "'lead', 'follow', or 'both'" },
        "geo_focus": { "type": "array", "items": { "type": "string" }, "description": "Where they invest (countries/regions)" },
        "sector_focus": { "type": "array", "items": { "type": "string" }, "description": "from taxonomy.json#/sectors" },
        "thesis": { "type": "string", "description": "1-3 sentence investment thesis / differentiation" }
      }
    },
    "program": {
      "type": "object",
      "description": "Accelerator / incubator program details",
      "properties": {
        "length_weeks": { "type": ["integer", "null"] },
        "cohort_size": { "type": ["integer", "string", "null"] },
        "batches_per_year": { "type": ["integer", "null"] },
        "equity_taken_pct": { "type": ["string", "number", "null"] },
        "investment": { "$ref": "#/$defs/money" },
        "format": { "type": "string", "description": "in-person / remote / hybrid" },
        "location": { "type": "string" },
        "demo_day": { "type": ["boolean", "null"] },
        "perks": { "type": "array", "items": { "type": "string" } },
        "application_url": { "type": "string" },
        "application_cycles": { "type": "array", "items": { "type": "string" }, "description": "deadlines / rolling / dates" },
        "acceptance_rate": { "type": ["string", "null"] },
        "eligibility": { "type": "string" }
      }
    },
    "track_record": {
      "type": "object",
      "properties": {
        "portfolio_count": { "type": ["integer", "string", "null"] },
        "notable_investments": {
          "type": "array",
          "items": {
            "type": "object",
            "properties": {
              "company": { "type": "string" },
              "sector": { "type": "string" },
              "outcome": { "type": "string", "description": "unicorn / IPO / acquired / active / shutdown" }
            }
          }
        },
        "exits": {
          "type": "array",
          "items": {
            "type": "object",
            "properties": {
              "company": { "type": "string" },
              "type": { "type": "string", "description": "IPO / M&A" },
              "year": { "type": ["integer", "null"] },
              "value": { "$ref": "#/$defs/money" }
            }
          }
        },
        "co_investors": { "type": "array", "items": { "type": "string" } }
      }
    },
    "people": {
      "type": "array",
      "items": {
        "type": "object",
        "properties": {
          "name": { "type": "string" },
          "role": { "type": "string" },
          "linkedin": { "type": "string" }
        }
      }
    },
    "team_size": { "type": ["integer", "string", "null"] },
    "application": {
      "type": "object",
      "properties": {
        "how_to_apply": { "type": "string" },
        "accepts_cold_inbound": { "type": ["boolean", "null"] },
        "contact": { "type": "string" }
      }
    },
    "tags": { "type": "array", "items": { "type": "string" } },
    "summary": {
      "type": "object",
      "description": "Short human-readable blurb",
      "properties": {
        "en": { "type": "string" },
        "local": { "type": "string" }
      }
    },
    "sources": {
      "type": "array",
      "minItems": 1,
      "description": "Provenance. Every quantitative claim should be traceable to a quote here.",
      "items": {
        "type": "object",
        "required": ["url"],
        "properties": {
          "url": { "type": "string" },
          "title": { "type": "string" },
          "publisher": { "type": "string" },
          "accessed": { "type": "string", "description": "YYYY-MM-DD the page was fetched" },
          "supports": { "type": "string", "description": "Which facts this source backs" },
          "quote": { "type": "string", "description": "Verbatim snippet backing a number/claim" }
        }
      }
    },
    "confidence": {
      "type": "string",
      "enum": ["high", "medium", "low"],
      "description": "high = official/primary; medium = reputable secondary; low = single weak/old source or inference"
    },
    "verification_notes": { "type": "string", "description": "Caveats, conflicting figures, what could not be verified" },
    "last_updated": { "type": "string", "description": "YYYY-MM-DD" },
    "researched_by": { "type": "string", "description": "agent segment id that produced this row" }
  },
  "$defs": {
    "money": {
      "type": "object",
      "description": "Money kept as reported (raw) to avoid fabricated conversions; usd optional when confidently derivable.",
      "properties": {
        "raw": { "type": "string", "description": "As reported, e.g. 'NT$2,000,000', '$150M', 'undisclosed'" },
        "usd": { "type": ["number", "null"] },
        "currency": { "type": "string" }
      }
    },
    "moneyRange": {
      "type": "object",
      "properties": {
        "raw": { "type": "string", "description": "e.g. '$250K–$2M', 'up to NT$10M'" },
        "usd_min": { "type": ["number", "null"] },
        "usd_max": { "type": ["number", "null"] }
      }
    }
  }
}
