[
  {
    "id": "in-quona-capital",
    "name": { "en": "Quona Capital" },
    "aka": ["Quona Capital Management", "Quona Accion Inclusion Fund"],
    "type": "vc",
    "subtypes": ["impact"],
    "status": "active",
    "founded_year": 2015,
    "region": "india",
    "country": "United States",
    "hq_city": "Washington, DC",
    "website": "https://quona.com/",
    "offices": [
      { "country": "United States", "city": "Washington, DC" },
      { "country": "India", "city": "Bengaluru" },
      { "country": "Singapore", "city": "Singapore" },
      { "country": "Brazil", "city": "São Paulo" },
      { "country": "Mexico", "city": "Mexico City" },
      { "country": "South Africa", "city": "Cape Town" }
    ],
    "links": {
      "crunchbase": "https://www.crunchbase.com/organization/quona-capital-management",
      "other": ["https://tracxn.com/d/venture-capital/quona/__PV8lEKeAUv3qr5j7aQrQJGW6DVJiy1j68gOT340ROrk"]
    },
    "capital": {
      "aum": { "raw": "$745M+ aggregate committed capital", "usd": 745000000, "currency": "USD" },
      "current_fund": { "raw": "$332M (Fund III, 2022)", "usd": 332000000, "currency": "USD" },
      "funds": [
        { "name": "Quona Accion Inclusion Fund III", "vintage_year": 2022, "size": { "raw": "$332M", "usd": 332000000, "currency": "USD" } }
      ]
    },
    "strategy": {
      "stages": ["seed", "series-a", "series-b"],
      "geo_focus": ["India", "Southeast Asia", "Latin America", "Africa", "MENA"],
      "sector_focus": ["fintech", "impact"],
      "thesis": "Early-stage fintech firm backing innovators that expand financial access for underserved consumers and small businesses across emerging markets, including India."
    },
    "track_record": {
      "portfolio_count": "70+",
      "notable_investments": [
        { "company": "ZestMoney", "sector": "fintech", "outcome": "active" },
        { "company": "Fisdom", "sector": "fintech", "outcome": "active" },
        { "company": "Rupifi", "sector": "fintech", "outcome": "active" }
      ]
    },
    "people": [
      { "name": "Monica Brand Engel", "role": "Co-founder & Partner" },
      { "name": "Jonathan Whittle", "role": "Co-founder & Partner" },
      { "name": "Ganesh Rengaswamy", "role": "Co-founding Partner (leads India & Southeast Asia)" }
    ],
    "tags": ["fintech", "financial-inclusion", "emerging-markets", "india-active"],
    "summary": {
      "en": "Washington DC-headquartered, fintech-focused emerging-markets VC firm (founded 2015) investing in financial-inclusion startups across India, Southeast Asia, Latin America, Africa and MENA. Closed its $332M Fund III in 2022; India/SEA investing is led from Bengaluru by co-founding partner Ganesh Rengaswamy."
    },
    "sources": [
      { "url": "https://quona.com/", "title": "Home - Quona Capital", "publisher": "Quona Capital", "accessed": "2026-06-02", "supports": "Fintech focus, geographies, portfolio impact", "quote": "We back bold fintech innovators expanding financial access globally, from Latin America to India and Southeast Asia to the EMEA region." },
      { "url": "https://techcrunch.com/2022/11/08/quona-capital-332m-financial-inclusion/", "title": "Quona Capital sinking $332M into startups focused on financial inclusion", "publisher": "TechCrunch", "accessed": "2026-06-02", "supports": "Fund III size, aggregate capital, founding, partners", "quote": "Quona Capital announced the final close of its third fund at $332 million ... brings the firm's aggregate committed capital to over $745 million." },
      { "url": "https://www.accion.org/news/quona-capital-closes-second-fund-with-203-million-aimed-at-financial-inclusion-in-emerging-markets/", "title": "Quona Capital Closes Second Fund with $203 Million", "publisher": "Accion", "accessed": "2026-06-02", "supports": "Founding year 2015, founders, financial inclusion mission", "quote": "Quona Capital ... founded in 2015 ... Monica Brand Engel, Jonathan Whittle, and Ganesh Rengaswamy" }
    ],
    "confidence": "high",
    "verification_notes": "Global fund headquartered in the US, but maintains a Bengaluru office and a dedicated India/SEA investing partner; included for strong India fintech focus. Country set to United States per HQ.",
    "last_updated": "2026-06-02",
    "researched_by": "fintech-vc"
  },
  {
    "id": "in-flourish-ventures",
    "name": { "en": "Flourish Ventures" },
    "aka": ["Flourish VC"],
    "type": "vc",
    "subtypes": ["impact"],
    "status": "active",
    "founded_year": 2019,
    "region": "india",
    "country": "United States",
    "hq_city": "San Francisco",
    "website": "https://flourishventures.com/",
    "offices": [
      { "country": "United States", "city": "San Francisco" },
      { "country": "United States", "city": "Washington, DC" },
      { "country": "United Kingdom", "city": "London" }
    ],
    "links": {
      "other": ["https://flourishventures.com/news/"]
    },
    "capital": {
      "aum": { "raw": "$850M (AUM after 2021 top-up)", "usd": 850000000, "currency": "USD" },
      "funds": [
        { "name": "Flourish Ventures (spinout vehicle)", "vintage_year": 2019, "size": { "raw": "up to $300M at spinout", "usd": 300000000, "currency": "USD" } }
      ]
    },
    "strategy": {
      "stages": ["seed", "series-a", "series-b"],
      "geo_focus": ["India", "Southeast Asia", "Africa", "Latin America", "United States"],
      "sector_focus": ["fintech", "impact"],
      "thesis": "Global fintech-focused VC (spun out of Omidyar Network in 2019) investing in founders building a fairer, more inclusive financial system; in India targets neo-banking, gig economy, embedded finance and insure-tech."
    },
    "track_record": {
      "portfolio_count": "71+",
      "notable_investments": [
        { "company": "M2P Fintech", "sector": "fintech", "outcome": "active" },
        { "company": "ZestMoney", "sector": "fintech", "outcome": "active" },
        { "company": "Indifi", "sector": "fintech", "outcome": "active" },
        { "company": "Kaleidofin", "sector": "fintech", "outcome": "active" },
        { "company": "Toffee", "sector": "fintech", "outcome": "active" }
      ]
    },
    "people": [
      { "name": "Tilman Ehrbeck", "role": "Managing Partner (India strategy spokesperson)" }
    ],
    "tags": ["fintech", "financial-inclusion", "omidyar-spinout", "india-active"],
    "summary": {
      "en": "US-headquartered fintech-only impact VC spun out of Omidyar Network in 2019 (~$850M AUM, sole LP Omidyar). Active across India in neo-banking, embedded finance, lending and insure-tech; India portfolio includes M2P Fintech, ZestMoney, Indifi, Kaleidofin and Toffee."
    },
    "sources": [
      { "url": "https://impactalpha.com/omidyar-network-spinoff-flourish-ventures-secures-350-million-to-invest-for-a-fair-financial-system/", "title": "Omidyar Network spinoff Flourish Ventures secures $350 million", "publisher": "ImpactAlpha", "accessed": "2026-06-02", "supports": "AUM, 2019 spinout, fintech focus", "quote": "Flourish added USD 350m ... bringing assets under management (AUM) to USD 850m ... capital seeded at the time of the firm's spinout from Omidyar Network in 2019." },
      { "url": "https://inc42.com/buzz/flourish-ventures-to-continue-its-investment-spree-in-indias-fintech-space/", "title": "Flourish Ventures To Continue Investment Spree In India's Fintech Space", "publisher": "Inc42", "accessed": "2026-06-02", "supports": "Fund size, India focus areas, India portfolio", "quote": "Flourish Ventures manages a $300 Mn fund which invests in fintech startups ... targets neo-banking, gig economy, embedded finance and insure-tech." },
      { "url": "https://techcrunch.com/2019/03/06/omidyar-network-spins-out-its-fintech-investment-arm-as-flourish-with-up-to-300-million/", "title": "Omidyar Network spins out its fintech investment arm as Flourish", "publisher": "TechCrunch", "accessed": "2026-06-02", "supports": "Spinout, up to $300M", "quote": "Omidyar Network spins out its fintech investment arm as Flourish, with up to $300 million" }
    ],
    "confidence": "high",
    "verification_notes": "Global fund headquartered in the US; covers India partly through Omidyar Network India. Country set to United States per HQ; included for dedicated India fintech activity.",
    "last_updated": "2026-06-02",
    "researched_by": "fintech-vc"
  },
  {
    "id": "in-cedar-ibsi-capital",
    "name": { "en": "Cedar-IBSi Capital" },
    "aka": ["Cedar Hill Capital", "Cedar Capital"],
    "type": "vc",
    "status": "active",
    "founded_year": 2024,
    "region": "india",
    "country": "India",
    "hq_city": "Mumbai",
    "website": "https://cedarhill.vc/",
    "links": {
      "other": ["https://tracxn.com/d/venture-capital/cedar-ibsi-capital/__dBdfWPt0g92n-9nF9UoRHsAevC8yrsTVVs_2KQnEkdM"]
    },
    "capital": {
      "current_fund": { "raw": "Rs 240 crore (~$30M) target; ~₹100 Cr committed (Aug 2025)", "usd": 30000000, "currency": "INR" },
      "funds": [
        { "name": "Cedar-IBSi Capital debut B2B FinTech Fund", "vintage_year": 2024, "size": { "raw": "Rs 175–240 crore (~$30M)", "usd": 30000000, "currency": "INR" } }
      ]
    },
    "strategy": {
      "stages": ["pre-seed", "seed", "series-a"],
      "check_size": { "raw": "$500,000 to $1 million", "usd_min": 500000, "usd_max": 1000000 },
      "geo_focus": ["India"],
      "sector_focus": ["fintech", "saas-enterprise"],
      "thesis": "India-focused B2B FinTech / BankTech fund backing AI-first enterprise technology for the BFSI industry — core tech stacks for banks, insurers and NBFCs; targets 10–15 companies, mostly Pre-A and A rounds."
    },
    "track_record": {
      "portfolio_count": "2",
      "notable_investments": [
        { "company": "Cogniquest", "sector": "fintech", "outcome": "active" },
        { "company": "WonderLend Hubs", "sector": "fintech", "outcome": "active" },
        { "company": "Sign3", "sector": "fintech", "outcome": "active" }
      ]
    },